{
  "$schema": "https://json-schema.org/draft/2020-12/schema",
  "$id": "https://github.com/emilio3435/Job-Bored/schemas/materials-qa.v1.schema.json",
  "title": "materials.qa.v1",
  "description": "Machine-readable QA result for one materials run and document (qa.resume.json, qa.letter.json; qa.json is the run's combined record). READY requires status `pass` and rubric score >= threshold; a document that still fails after at most one automatic repair is FAIL with its reasons; anything else is REVIEW.",
  "type": "object",
  "required": ["contract", "status", "disposition", "measurements", "rubric", "checks"],
  "additionalProperties": false,
  "properties": {
    "contract": { "const": "materials.qa.v1" },
    "runId": { "type": "string" },
    "document": { "enum": ["resume", "letter"] },
    "status": { "enum": ["pass", "review", "fail"] },
    "disposition": { "enum": ["READY", "REVIEW", "FAIL"] },
    "dispositionReason": { "type": "string" },
    "degraded": { "type": "array", "items": { "type": "string" } },
    "repair": {
      "type": "object",
      "required": ["attempted"],
      "additionalProperties": false,
      "properties": {
        "attempted": { "type": "boolean" },
        "before": {
          "type": "object",
          "additionalProperties": false,
          "properties": {
            "status": { "type": "string" },
            "score": { "type": "integer" },
            "max": { "type": "integer" },
            "codes": { "type": "array", "items": { "type": "string" } }
          }
        }
      }
    },
    "measurements": {
      "type": "object",
      "additionalProperties": true,
      "properties": {
        "resumePages": { "type": "integer", "minimum": 0 },
        "resumePageBudget": { "type": "integer", "minimum": 1, "maximum": 2 },
        "resumeVisibleWords": { "type": "integer", "minimum": 0 },
        "resumeFeaturedBullets": { "type": "array", "items": { "type": "integer" } },
        "letterPages": { "type": "integer", "minimum": 0 },
        "letterBodyWords": { "type": "integer", "minimum": 0 },
        "letterParagraphs": { "type": "integer", "minimum": 0 },
        "nounCoverage": { "type": "number", "minimum": 0, "maximum": 1 },
        "bannedHits": { "type": "integer", "minimum": 0 },
        "cadenceFlags": { "type": "integer", "minimum": 0 },
        "atsTextParity": { "type": "number", "minimum": 0, "maximum": 1 },
        "fitSolverIterations": { "type": "integer", "minimum": 0 }
      }
    },
    "rubric": {
      "type": "object",
      "required": ["score", "max", "threshold", "rows"],
      "additionalProperties": false,
      "properties": {
        "score": { "type": "integer", "minimum": 0 },
        "max": { "type": "integer", "minimum": 1 },
        "threshold": { "type": "integer", "minimum": 0 },
        "rows": {
          "type": "array",
          "minItems": 1,
          "items": {
            "type": "object",
            "required": ["id", "score"],
            "additionalProperties": false,
            "properties": {
              "id": {
                "enum": [
                  "thesis",
                  "differentiator",
                  "outcome-ladder",
                  "noun-coverage",
                  "reporting-line",
                  "constraints",
                  "outcome_coverage",
                  "noun_fidelity",
                  "proof_density",
                  "transfer_honesty",
                  "omission_record",
                  "delint_clean",
                  "metric_dropped",
                  "underfill",
                  "company_specificity",
                  "metric_in_letter",
                  "letter_ungrounded",
                  "sounds_human"
                ]
              },
              "score": { "type": "integer", "minimum": 0, "maximum": 2 },
              "max": { "type": "integer", "minimum": 1 },
              "document": { "enum": ["resume", "letter"] },
              "note": { "type": "string" }
            }
          }
        }
      }
    },
    "checks": {
      "type": "array",
      "minItems": 1,
      "items": {
        "type": "object",
        "required": ["code", "severity", "message"],
        "additionalProperties": false,
        "properties": {
          "code": { "type": "string", "minLength": 1 },
          "severity": { "enum": ["pass", "note", "review", "fail"] },
          "stage": { "type": "string" },
          "message": { "type": "string" }
        }
      }
    },
    "cache": {
      "type": "object",
      "required": ["key", "hit"],
      "additionalProperties": false,
      "properties": {
        "key": { "type": "string" },
        "hit": { "type": "boolean" }
      }
    }
  }
}
