{
  "contract": "materials.qa.v1",
  "runId": "mr_2026091718_3e_7f21",
  "status": "review",
  "disposition": "REVIEW",
  "dispositionReason": "One review-severity check: constraint_conflict. No fails, rubric above threshold.",
  "measurements": {
    "resumePages": 1,
    "resumePageBudget": 1,
    "resumeVisibleWords": 376,
    "resumeFeaturedBullets": [3, 3],
    "letterPages": 1,
    "letterBodyWords": 200,
    "letterParagraphs": 4,
    "nounCoverage": 0.8,
    "outcomeLadder": 1.0,
    "bannedHits": 0,
    "cadenceFlags": 0,
    "atsTextParity": 1.0,
    "fitSolverIterations": 1,
    "pdfBytes": { "resume": 152384, "coverLetter": 108065 }
  },
  "rubric": {
    "score": 11,
    "max": 12,
    "threshold": 10,
    "rows": [
      { "id": "thesis", "score": 2, "note": "Statement names the 60/40 split and the job to be done in the first two lines" },
      { "id": "differentiator", "score": 2, "note": "25-skill / 15-connection graph claimed through a real analog, twice, with ops proof" },
      { "id": "outcome-ladder", "score": 2, "note": "Every featured bullet lands on an extract outcome" },
      { "id": "noun-coverage", "score": 2, "note": "8 of 10 weighted nouns present; misses are Power BI and DAX, both unowned" },
      { "id": "reporting-line", "score": 2, "note": "Demand Gen named in the letter; QBR/partner motion shown on the resume" },
      { "id": "constraints", "score": 1, "note": "Surfaced as constraint_conflict rather than resolved; human decision required" }
    ]
  },
  "checks": [
    { "code": "resume_page_count", "severity": "pass", "stage": "qa", "message": "1 page at template defaults (PDF page count, not HTML estimate)" },
    { "code": "letter_page_count", "severity": "pass", "stage": "qa", "message": "1 page" },
    { "code": "letter_word_budget", "severity": "pass", "stage": "qa", "message": "200 words, inside 180–260" },
    { "code": "statement_present", "severity": "pass", "stage": "qa", "message": "44 words, no title stacking" },
    { "code": "banned_filler", "severity": "pass", "stage": "delint", "message": "0 hits across 40 patterns and 3 JD echo bans" },
    { "code": "ai_cadence", "severity": "pass", "stage": "delint", "message": "No 3-wide parallel bullet skeletons, no adjective stacks, 2 em-dashes in the letter" },
    { "code": "jd_noun_coverage", "severity": "pass", "stage": "qa", "message": "0.80 weighted coverage (threshold 0.6 review, 0.5 fail)" },
    { "code": "differentiator_claimed", "severity": "pass", "stage": "qa", "message": "skills-graph-ownership claimed via elio-platform and elio-ops" },
    { "code": "transfer_overclaim", "severity": "pass", "stage": "qa", "message": "Power BI and DAX appear only as prose-new in letter p4; excluded from resume tokens" },
    { "code": "invented_fact", "severity": "pass", "stage": "qa", "message": "Every metric run traces to a ledger token; 0 untraced numerals" },
    { "code": "omission_justified", "severity": "pass", "stage": "qa", "message": "Bucketz and Hormiga omitted with recorded reasons; frozen-fact rule applies to kept claims only" },
    { "code": "ats_text_parity", "severity": "pass", "stage": "qa", "message": "resume.txt and cover-letter.txt contain the statement and all 6 featured bullets; rail carries no unique claim" },
    {
      "code": "constraint_conflict",
      "severity": "review",
      "stage": "extract",
      "message": "Posting authorizes Colorado excluding Denver; candidate is in Denver. Not rewritten, not hidden, no invented Maryland address. Human decision."
    }
  ],
  "cache": {
    "key": "sha256:9f1c0b7a4e2d5831|sha256:4be71d90c5a2f6e8|signal@1.0|materials.prompts.v3.0",
    "hit": false
  }
}
